BibliographyType,ISBN,Identifier,Author,Title,Journal,Volume,Number,Month,Pages,Year,Address,Note,URL,Booktitle,Chapter,Edition,Series,Editor,Publisher,ReportType,Howpublished,Institution,Organizations,School,Annote,Custom1,Custom2,Custom3,Custom4,Custom5
5,"","BIM18","Buono, D.; Infante, E.; Mazzi, G. L.","Short versus long time series: An empirical analysis","",,,"","669-680",2018,"","","https://ec.europa.eu/eurostat/documents/3859598/8939616/KS-GQ-18-001-EN-N.pdf","Handbook on {S}easonal {A}djustment","25","","","","Publications Office of the European Union","","","","","","","Most of the literature on business cycle analysis relies, as input, on the seasonally adjusted (SA) data of the main economic indicators. The rationale is that the seasonal frequencies are different from the frequencies of the cycles, then seasonal movements do not carry useful information, moreover they can hide the information on the frequencies of interest in business cycle analysis. This idea is coherent with the literature on SA that rests on the hypothesis of orthogonality among the seasonal and the others components. For several reasons this hypothesis can fail and an interaction between seasonal and business cycles can arise. This work address the plausibility of this hypothesis and a first study on the effect that different seasonal adjustment algorithms can have on the business cycle analysis due to their different ability in separating the seasonal from the other frequencies. Empirically the evidence or the presence of interactions can be hardly detectable. There are several reasons: components are unobservable as well as their connections, consequently. Moreover, the series are often characterized by instability, and/or evolutionary behaviour of the components. Aim of this work can be summarized in: empirical investigation of the effects of a variety of SA methods on two aspects: the cyclical shape of the series and the turning point dating. The focus is on the growth cycle. The approach will be historical, and then no real time exercises is run.","","","",""
5,"","Bujnowska19","Bujnowska, A.","Access to European Statistical System microdata","",,,"","87-99",2019,"","","https://www.springer.com/gp/book/9783319784601","Data-Driven Policy Impact Evaluation \textendash{} How Access to Microdata is Transforming Policy Design","","","","Crato, N.; Paruolo, P.","Springer","","","","","","","","","","",""
5,"","CS14","Chiappero-Martinetti, E.; Sabadash, A.","Integrating human capital and human capabilities in understanding the value of education","",,,"","206-230",2014,"London, UK","MPRA Paper 61800","https://link.springer.com/content/pdf/10.1057%2F9781137001436.pdf","The Capability Approach: From Theory to Practice","9","","","Ibrahim, S.; Tiwari, M.","Palgrave Macmillan","","","","","","","The aim of this chapter is to investigate the possibility of combining human capital theory (HCT) and the capability approach (CA) in order to better understand and measure both the instrumental and the intrinsic values of education for individuals, and to trace its relative spillover effects on societies. HCT, pioneered by Schultz and Becker in the early 1970s, has since become an important part of the debate on economic growth and development. Recently, HCT has been criticised for the narrow instrumental role that it assigns to education (inasmuch as HCT disregards some of important non-material aspects of education), as well as for its inability to satisfactorily reflect the cultural, gender-based, emotional and historical differences that can influence educational choices and individual well-being.","see also https://mpra.ub.uni-muenchen.de/61800/1/MPRA_paper_61800.pdf","","",""
5,"","Eiselt16","Eiselt, B.","LUCAS-Erhebung: Boden\-bedeckung und Boden\-nutzung in der EU","",,,"","",2016,"","","http://slub.qucosa.de/api/qucosa\%3A16825/attachment/ATT-0/","Fl{\"a}chen\-nutzungs\-monitoring {VIII}. Fl{\"a}chen\-sparen \textendash{} {\"O}ko\-system\-leis\-tungen \textendash{} {H}andlungs\-strategien","","","","Meinel, G.; F{\"o}rtsch, D.; Schwarz, S.; Kr{\"u}ger, T.","","","","","","","","","","","",""
5,"","GLM18","Gatto, R.; Ladiray, D.; Mazzi, G. L.","The effect of alternative seasonal adjustment methods on business cycle analysis","",,,"","629-654",2018,"","","https://ec.europa.eu/eurostat/documents/3859598/8939616/KS-GQ-18-001-EN-N.pdf","Handbook on {S}easonal {A}djustment","23","","","","Publications Office of the European Union","","","","","","","Seasonal adjustment procedures are usually designed for being applied on sufficiently long time series in order to obtain good quality results. This is due both to technical reasons such as the properties of the symmetric filters used and to non-technical ones such as the fact that, over a sufficiently long time period, components can be better identified and separated; consequently, the seasonal component can be more precisely estimated and eventually removed. In addition, long time series are required in order to read properly the statistics of the seasonality tests. Furthermore, on short time series the seasonality tests might be less robust. In official statistics, available time series associated to statistical indicators are often relatively short or subject to some shortening processes. This seems to contradict one of the main quality dimensions of statistics which is the coverage, but, at the same time, official statistics need to be continuously improved to better reflect the socio-economic structure. This process unavoidably leads to regularly adapting existing official statistics to evolving socio-economic structure. Furthermore better reflecting the current socio-economic situation can also require the development and the statistical compilation of new indicators, which at least in a first phase will cover only a limited time span. These two processes imply, at least temporarily, the availability of short time series associated to the statistical indicators.","","","",""
5,"","Gotfried15","G{\"o}tzfried, A.","Modernising Official Statistics: A complex challenge","",,,"","3-11",2015,"","","https://link.springer.com/chapter/10.1007%2F978-3-662-44983-7_1","Data Science, Learning by Latent Structures, and Knowledge Discovery","","","Studies in Classification, Data Analysis, and Knowledge Organization","Lausen, B.; Krolak-Schwerdt, S.; B{\"o}hmer, M.","Springer","","","","","","","In Europe, national statistical organisations and Eurostat, the statistical office of the European Union, produce and disseminate official statistics. These organisations come together as partners in the European Statistical System (ESS). This paper describes the ESS, the challenges it faces and the modernisation efforts that have been undertaken based on a redesigned ESS enterprise architecture. It also outlines the probable future direction of the ESS.","","","",""
7,"","AFMMV17","Aprigliano, V.; Foroni, C.; Marcellino, M.; Mazzi, G.; Venditti, F.","A daily indicator of economic growth for the Euro area","International Journal of Computational Economics and Econometrics",7,1-2,"","43-63",2017,"","","http://www.igier.unibocconi.it/files/570.pdf","","","","","","","","","","","","","In this paper, we study alternative methods to construct a daily indicator of growth for the euro area. We aim for an indicator that (i) provides reliable predictions, (ii) can be easily updated at the daily frequency, (iii) gives interpretable signals, and (iv) it is linear. Using a large panel of daily and monthly data for the euro area we explore the performance of two classes of models: bridge and U-MIDAS models, and different forecast combination strategies. Forecasts obtained from U-MIDAS models, combined with the inverse MSE weights, best satisfy the required criteria.","","","",""
7,"","AGKRV15","Agafitei, M.; Gras, F.; Kloek, W.; Reis, F.; V\^aju, S. C.","Measuring output quality for multisource statistics in official statistics: Some directions","Statistical Journal of the IAOS",31,2,"","203-211",2015,"","","https://content.iospress.com/download/statistical-journal-of-the-iaos/sji902?id=statistical-journal-of-the-iaos\%2Fsji902","","","","","","","","","","","","","Many statistical offices have been moving towards an increased use of administrative data sources for statistical purposes, both as a substitute and as a complement to survey data. Moreover, the emergence of big data constitutes a further increase in available sources. As a result, statistical output in official statistics is increasingly based on complex combinations of sources.The quality of such statistics depends on the quality of the primary sources and on the ways they are combined.This paper analyses the appropriateness of the current set of output quality measures for multiple source statistics, it explains the need for improvement and outlines directions for further work. The usual approach for measuring the quality of the statistical output is to assess quality through the measurement of the input and process quality. The paper argues that in multisource production environment this approach is not sufficient. It advocates measuring quality on the basis of the output itself - without analysing the details of the inputs and the production process - and proposes directions for further development.","","","",""
7,"","BGV19","Bikauskaite, A.; G{\"o}tzfried, A.; V{\"o}lfinger, Z.","The EuroGroups Register","Statistika",99,1,"","69-76",2019,"","","https://www.czso.cz/documents/10180/88506450/32019719q1_069.pdf","","","","","","","","","","","","","Globalisation presents significant statistical challenges, particularly for small and open economies in terms of measuring statistical indicators and communicating the results to users. The European Statistical System allocated high priority to the better measuring of globalisation in the statistical processes and output, in business or macro-economic statistics. Some concrete actions were already undertaken such as setting up of the EuroGroups Register of multinational enterprise groups and the putting in place of a so-called Early-warning System for monitoring restructurings of the groups. This paper focuses on the EuroGroups Register (EGR), the central statistical business register of Eurostat and the EU and EFTA countries' statistical authorities. The EGR is part of the EU statistical infrastructure and has been built up to better capture globalisation effects as well as for improving the consistency of national data on enterprise groups 4 .","","","",""
7,"","BLL15","Bautier, P.; Laevaert, C.; Le Goff, B.","Tracking users for a targeted dissemination","Statistika",95,4,"","77-78",2015,"","","https://www.czso.cz/documents/10180/20550319/32019715q4067.pdf","","","","","","","","","","","","","How to build a dissemination and communication strategy in a world where users have easy access to a deluge of data and information from various origins and where IT tools and design standards change so quickly that users behaviour and their expectations are continuously modified? The first challenge of Eurostat is clearly to know what users want: we know our different types of users but we have to identify how they get our data, what they do with our data, how they react to our outputs and which sort of new service they would like us to propose. Translating these needs into a visual dissemination is a new challenge undertaken by Eurostat through a new portal, new mobile apps and new info graphs and basic application as well as increasing the visibility on Google. The objective of this paper is to share Eurostat's experience in identifying user needs and to show how concretely this information has been visually disseminated.","","","",""
7,"","BM09","Bujnowska, A.; Museux, J.-M.","Release of European Union microdata, ESS projects on remote access","Statistical Journal of the IAOS",26,3-4,"","89-94",2009,"","","https://content.iospress.com/download/statistical-journal-of-the-iaos/sji00709?id=statistical-journal-of-the-iaos%2Fsji00709","","","","","","","","","","","","","This paper outlines microdata access methods at the European level, and specifically to data governed by European Union (EU) Regulation 831/2002 or where explicit approval of the EU Members is given on the access to particular datasets via Eurostat safe centre. Access to EU microdata for research purposes was enabled in 2002 when the Commission Regulation (EC) No 831/2002 came into force. Since then more than 100 contracts have been signed each year with research organisations for the provision of microdata for scientific purposes. The current Regulation foresees two ways of access to microdata: access to anonymised microdata files, and access to confidential data in the safe centre in Eurostat premises in Luxembourg. The first part of the paper outlines the legal framework at the EU level. The second part discusses the different modes and conditions of access as well as practical issues related to access to microdata in general. The final part provides an overview of the projects currently carried out in the domain of remote access at the European level. The situation with regards to the access to EU microdata will evolve in the near future with the new regulatory framework and subsequent changes in the governance structure for statistical confidentiality in the European Statistical System.","","","",""
7,"","BMKMP17","Buono, D.; Mazzi, G. L.; Kapetanios, G.; Marcellino, M.; Papailias, F.","Big data types for macroeconomic nowcasting","Eurostat Review on National Accounts and Macroeconomic Indicators (EURONA)",1,,"","67-77",2017,"","","https://ec.europa.eu/eurostat/cros/system/files/euronaissue1-2017-art4.pdf","","","","","","","","","","","","","In this paper we present a detailed discussion on various types of big data which can be useful in macroeconomic nowcasting. In particular, we review the big data sources, availability, specific characteristics and their use in the literature. We conclude this paper identifying the big data types which could be adopted for real applications.","","","",""
7,"","BSEMA17","Brandmueller, T.; Sch{\"a}fer, G.; Ekkehard, P.; M{\"u}ller, O.; Angelova-Tosheva, V.","Territorial indicators for policy purposes: NUTS regions and beyond","Regional Statistics",7,1,"","78-89",2017,"","","http://www.ksh.hu/docs/hun/xftp/terstat/2017/rs070105.pdf","","","","","","","","","","","","","Regional statistics, along with the NUTS (Nomenclature des Unités Territoriales Statistiques, or Nomenclature of Territo-rial Units for Statistics) classification, al-ready have a solid tradition. They have developed into a very useful tool for de-tailed analyses and have become the basis for important decisions in the allocation of EU funding. Gradually, the scope of regional statistics has widened, and re-gional statistics now play a role in several statistical domains with a wide range of statistical indicators. The recognition that many of the social and economic issues Europe faces today have urban or rural characteristics has led to an initiative to supplement statistical da-ta on NUTS regions with data on cities and rural areas. These sub-national statistics allow policy makers to better target their policies. For example, in some parts of Eu-rope, poverty and social exclusion are clear-ly an urban problem, while in other areas they are primarily a rural problem. A further aspect that has gained considera-ble importance in territorial policy making - as well as in public awareness - concerns the so-called functional regions, which are selected or constructed from more detailed geographical units according to specific features. The labour market area is one ex-ample of this type of functional delinea-tion, which helps to shed light on im-portant territorial characteristics. The fast-growing use of geographic in-formation and new technical facilities has created possibilities for merging statistics and related geographical information into so-called spatial statistics. An example is grid-based population data, which helps to determine the concrete locations of peo-ple with access to certain facilities (e.g. public transport, airports) or to identify a population close to the sea. Through the intensive use of map-related functions, the utility of regional and urban statistics can also be enhanced, and different statistics can be combined. This paper argues that different sub-national statistics offer different but inter-related perspectives. They can be com-bined in multiple ways to create new pos-sibilities for policy analysis and to illus-trate social and economic characteristics at varying levels of geographic detail.","","","",""
7,"","DM13","Defays, D.; Museux, J.-M.","Discussion","Journal of Official Statistics",29,1,"","147-155",2013,"","","https://content.sciendo.com/view/journals/jos/29/1/article-p147.xml","","","","","","","","","","","","","This discussion draws mainly on four contributions in this special issue (those of Statistics New Zealand, NASS, RTI International and Statistics Netherlands) that report on experiences in integrating statistical production systems with a direct focus on industrialisation and integration-related issues. The framework proposed by Eltinge et al. for the integration of architecture and methodology is also taken on board. The article on the Real-Time Online Analytic System (Westat/NCHS) is marginally integrated into the discussion on data access.","","","",""
7,"","HMKK17","Hamadeh, N.; Mouyelo-Katoula, M.; Konijn, P.; Koechlin, F.","Purchasing power parities of currencies and real expenditures from the international comparison program: Recent results and uses","Social Indicators Research",131,1,"","23-42",2017,"","","https://link.springer.com/content/pdf/10.1007%2Fs11205-015-1215-z.pdf","","","","","","","","","","","","","The International Comparison Program (ICP) is a worldwide statistical initiative designed to estimate purchasing power parities (PPPs) that can be used as currency converters to compare the performance of countries around the world, thereby providing in-depth views of the distribution of resources worldwide. The 2011 round of the ICP was leveraged on the successful outcome of the 2005 round that included 146 countries, introducing various methodological improvements. The summary report and results from the 2011 round were released in April 2014 and provided PPPs, price levels indices, and expenditures in PPP terms for the GDP and major aggregates for 199 participating countries. More detailed results were released in June 2014 and a final comprehensive report in October 2014. The final report provided a more in-depth analysis of volume and per capita indices. The results stirred a strong debate among the user community because of their finding that the world has become more equal than previously thought. The purpose of this paper is to provide an overview of the main results and findings of ICP 2011, its governance framework and partnership with the Eurostat-Organization for Economic Co-operation and Development (OECD) PPP program, and the major methodological innovations that were implemented. The paper reviews the major uses of the PPPs generated by the ICP 2011 and the Eurostat-OECD PPP program, and concludes with thoughts about the future of the ICP.","","","",""
7,"","HS17","Hagsten, E.; Sabadash, A.","A neglected input to production: The role of ICT-schooled employees in firm performance","International Journal of Manpower",38,3,"","373-391",2017,"","","https://www.emerald.com/insight/content/doi/10.1108/IJM-05-2015-0073/full/pdf?title=a-neglected-input-to-production-the-role-of-ict-schooled-employees-in-firm-performance","","","","","","","","","","","","","The purpose of this paper is to broaden the perspective on how information and communication technology (ICT) relates to productivity by introducing a novel ICT variable: the share of ICT-schooled employees in firms, an intangible input often neglected or difficult to measure.","","","",""
7,"","HZFP16","Haldorson, M.; Zaccheddu, P.-G.; Fohgrub, B.; Petri, E.","Geospatial information management in Europe \textendash Responding to the user needs","Statistical Journal of the IAOS",32,4,"","481-487",2016,"","","https://content.iospress.com/download/statistical-journal-of-the-iaos/sji1010?id=statistical-journal-of-the-iaos%2Fsji1010","","","","","","","","","","","","","The United Nations initiative on Global Geospatial Information Management (UN-GGIM) aims at playing a leading role in setting the agenda for the development of global geospatial information and to promote its use to address key global challenges like the UN Sustainable Development Goals. The regional committee UN-GGIM: Europe was established in October 2014 and by October 2015, at its second plenary meeting, recommendations were adopted on better integration of geospatial and statistical information in order to foster further usage. The recommendations can be found in a report titled ''Definition of the priority user needs for combinations of data''. This article reflects the main content of the report: identifying relevant policies, collecting use cases, describing and responding to user needs and finally making recommendations on how to improve the integration of statistical and geospatial information. The most strategic recommendation is that Europe should aim for a European Spatial Data Strategy. Other recommendations deal with priority data for a Statistical Geospatial Framework and support the improvement of workflows with geospatial technology.","","","",""
7,"","IBB15","Infante, E.; Buono, D.; Buono, A.","A 3-way ANOVA a priori test for common seasonal patterns and its application to direct versus indirect methods","Eurostat Review on National Accounts and Macroeconomic Indicators (EURONA)",1,,"","93-145",2015,"","","https://ec.europa.eu/eurostat/cros/system/files/05y-newanova_techsav_dtp_final.pdf","","","","","","","","","","","","","In this paper we propose a new a priori test to be used for the identification of a common seasonal pattern. The test is applied a priori to any running of a seasonal adjustment procedure. The test is a three way ANOVA, where the three factors are the series, the time frequency and the year. One of the possible applications of using such a test would be when selecting either the direct or indirect approach when seasonally adjusting. The Seasonally Adjusted series of an aggregate can be obtained by seasonal adjusting it (direct approach) or by aggregating the seasonally adjusted individual series (indirect approach). It should be noted that, to date, the literature has been mainly focusing on an a posteriori comparison among the results achieved by applying different approaches. This paper seeks to set out an a priori strategy for the identification of the most effective seasonal adjustment of the aggregate.","","","",""
7,"","IMZKPRS16","Ioannidis, E.; Merkouris, T.; Zhang, L.-C.; Karlberg, M.; Petrakos, M.; Reis, F.; Stavropoulos, P.","On a modular approach to the design of integrated social surveys","Journal of Official Statistics",32,2,"","259-286",2016,"","","https://content.sciendo.com/view/journals/jos/32/2/article-p259.xml","","","","","","","","","","","","","This article considers a modular approach to the design of integrated social surveys. The approach consists of grouping variables into ‘modules’, each of which is then allocated to one or more ‘instruments’. Each instrument is then administered to a random sample of population units, and each sample unit responds to all modules of the instrument. This approach offers a way of designing a system of integrated social surveys that balances the need to limit the cost and the need to obtain sufficient information. The allocation of the modules to instruments draws on the methodology of split questionnaire designs. The composition of the instruments, that is, how the modules are allocated to instruments, and the corresponding sample sizes are obtained as a solution to an optimisation problem. This optimisation involves minimisation of respondent burden and data collection cost, while respecting certain design constraints usually encountered in practice. These constraints may include, for example, the level of precision required and dependencies between the variables. We propose using a random search algorithm to find approximate optimal solutions to this problem. The algorithm is proved to fulfil conditions that ensure convergence to the global optimum and can also produce an efficient design for a split questionnaire.","","","",""
7,"","Karlberg16","Karlberg, M.","Reviewers should ask the right questions \textendash But is InfoQ the answer?","Statistical Journal of the IAOS",32,1,"","29-31",2016,"","","https://content.iospress.com/download/statistical-journal-of-the-iaos/sji980?id=statistical-journal-of-the-iaos%2Fsji980","","","","","","","","","","","","","Kenett and Shmueli rightly note that statisticiansin academia, industry (and the public sector for that matter!) are regularly reviewing papers for journals without a general framework to help them guide the review process, meaning that "it is typically left to the reviewer's experience and good sense to determine the contribution of a paper". The inevitable consequence is indeed that the review process "is usually carriedout in an unstructured way with inherent variability between reviewers".To remedy this regrettable state of affairs, the authors propose that a set of items based on the InfoQ framework be adopted in the reviewing process of applied journals. This discussion paper which reflects on their proposal, starts by identifying possible actions complementary to a reviewing framework in Section 2. Thereafter, the applicability of the proposed framework is discussed in Section 3, while Section 4 contains some concluding remarks.","","","",""
