BibliographyType,ISBN,Identifier,Author,Title,Journal,Volume,Number,Month,Pages,Year,Address,Note,URL,Booktitle,Chapter,Edition,Series,Editor,Publisher,ReportType,Howpublished,Institution,Organizations,School,Annote,Custom1,Custom2,Custom3,Custom4,Custom5
13,"","BAR17","Buono, D.; Amores, A. F.; R\'emond-Tiedrez, I.","Data analytics: European wheel of competitiveness","",,,"","",2017,"","Statistical Working Papers","https://op.europa.eu/en/publication-detail/-/publication/5ce64720-41ed-11e8-b5fe-01aa75ed71a1/language-en","","","","","","","","","Eurostat","","Eurostat","","This study aims to realize a statistical analysis of competitiveness in the EU-28 based on a statistical reference framework, previously defined as the European Wheel of Competitiveness. This framework comprises a list of 35 indicators (EWoC indicators) related to macroeconomics, microeconomics, globalization, environment and socio-institutional aspects. The analytical methods for this study were established in line with the Statistical reference framework for competitiveness analysis in the EU-28 Member States. As a rather broad concept, competitiveness can be described by a large set of different factors and definitions. The aim of this analysis is to show possible redundancy between indicators, but also possible explanatory power. Moreover, it tests the initial assumption that the largest principal components will be sufficient to explain the variability in the observed dataset. Finally, it detects possible patterns based on available set of indicators. Results confirmed some well-known correlations. For instance, the unemployment rate is positively correlated with the indicator People at risk of poverty or social exclusion (AROPE), which is also negatively correlated with the Real GDP per capita. Nevertheless, the performed correlation analysis did not provide any substantial results regarding some other expected correlations. It has to be mentioned at this point that, the presence or the absence of correlation results between several indicators of the set of EWoC indicators, is a fact that should not be understand as a weakness of the EWoC framework but rather as a strength due to the fact that there is not redundant information. Exploring the high correlations between the aforementioned indicators and indicators by themselves, it was decided to control for the indicator 4. Concerning the results obtained with partial correlation analysis, it was evident that most of the previously captured correlation actually comes from the Gross domestic expenditure on R\&D. More precisely, when controlling the correlation for the aforementioned indicator, the correlation across EWoC indicators becomes weaker or insignificant in almost all cases. For that reason, and other reasons detailed in the article, indicator 4 was not used for the latter analysis. Finally, the correlation analysis showed that indicator 34: Control of corruption could be also removed from the set of the EWoC indicators. The cross-correlation analysis explored time series correlation and showed that for the same pair of indicators, different or opposite correlation results can be obtained. This proved that countries may react differently and in several periods in time, to similar economic changes. This result provided the idea of countries clustering. In addition, obtained correlation coefficients vary from country to country. Therefore, it was of interest to look for the evidence of formation of groups of countries. In another words, the country-clusters. EU-28The performed analysis showed that the "old" EU Member States (France, Germany, United Kingdom, Italy...) form a cluster while the Eastern EU countries, i.e. "newest"Member States (Estonia, Latvia, Lithuania, Poland, Bulgaria, Romania, Croatia...) form a separate cluster. It is also noteworthy the fact that Luxembourg stands out as being very different, insofar as it forms its own cluster (Figure 1). The explored dataset consists of 29 indicators for time span 2000-2014. Therefore, it seemed logic to examine opportunities for the reduction of dimensionality or indicators` grouping. All analysis (Principal Components, k-means cluster analysis and Gaussian mixture model and the Hierarchical agglomerative clustering analysis) showed that indicators, either as a component of one linear combination or as a member of one group, can be classified into 4 groups. It is noteworthy the fact that indicator 29: Real GDP per capita stands out as being different, insofar as it forms its own cluster","","","",""
13,"","BBKKMMP16","Baldacci, E.; Buono, D.; Kapetanios, G.; Krische, S.; Marcellino, M. G.; Mazzi, G. L.; Papailias, F.","Big data and macroeconomic nowcasting: From data access to modelling","",,,"","",2016,"","Statistical Books","https://ec.europa.eu/eurostat/documents/3888793/7753027/KS-TC-16-024-EN-N.pdf","","","","","","","","","Eurostat","","Eurostat","","Parallel advances in IT and in the social use of Internet-related applications, provide the general public with access to a vast amount of information. The associated Big Data are potentially very useful for a variety of applications, ranging from marketing to tapering fiscal evasion. From the point of view of official statistics, the main questions is whether and to what extent Big Data are a field worth investing to expand, check and improve the data production process and which types of partnerships will have to be formed for this purpose. Nowcasting of macroeconomic indicators represents a well-identified field where Big Data has the potential to play a decisive role in the future. In this paper we present the results and main recommendations from the Eurostat-funded project "Big Data and macroeconomic nowcasting", implemented by GOPA Consultants, which benefits from the cooperation and work of the Eurostat task force on Big Data and a few external academic experts.","","","",""
13,"","FJTOPE16","Fern\'andez-Ugalde, O.; Jones, A.; T\'oth, G.; Orgiazzi, A.; Panagos, P.; Eiselt, B.","LUCAS soil component: Proposal for analysing new physical, chemical and biological soil parameter","",,EUR 28038EN,"","",2016,"","","https://publications.jrc.ec.europa.eu/repository/bitstream/JRC102485/lb-na-28038-en-n\%20.pdf","","","","","","","","","Joint Research Centre of the European Commission","","Joint Research Centre of the European Commission","","While unemployment in the EU is above 10\%, the job vacancy rate also remains high around 1.5\%. This suggests considerable unmet demand for skills, which is in the focus of the EU employment promotion policies. This paper studies the special role that schooled ICT experts in firms - an intangible input often neglected and difficult to measure - play for productivity. The effects are investigated both in isolation and in conjunction with the impact of ICT maturity on microdata in six European countries (UK, France, Sweden, Norway, Denmark and Finland) for the period 2001-2009. We find that increases in the proportion of ICT-intensive human capital boosts productivity. This seems to confirm the case in favour of recruitment of highly skilled ICT employees. However, the gains vary across countries and industries, suggesting that the channels through which the effects operate are narrower for ICT-intensive human capital than for skilled human capital in general. Our findings provide an important message to the EU employment policy debate that currently revolves around the skill mismatch in general and the unmet demand for ICT skills in particular.","","","",""
13,"","HS14","Hagsten, E.; Sabadash, A.","The impact of highly-skilled ICT labour on firm performance: Empirical evidence from six European countries","",,JRC89703,"","",2014,"","Working Papers on Digital Economy 2014-02","https://ec.europa.eu/jrc/sites/jrcsh/files/ReqNo_JRC89703_The%20Impact%20of%20Highly-skilled%20ICT%20Labour%20on%20Firm%20Performance%20Empirical%20Evidence%20from%20Six%20Countries.pdf","","","","","","","","","Joint Research Centre of the European Commission","","Joint Research Centre of the European Commission","","While unemployment in the EU is above 10\%, the job vacancy rate also remains high around 1.5\%. This suggests considerable unmet demand for skills, which is in the focus of the EU employment promotion policies. This paper studies the special role that schooled ICT experts in firms - an intangible input often neglected and difficult to measure - play for productivity. The effects are investigated both in isolation and in conjunction with the impact of ICT maturity on microdata in six European countries (UK, France, Sweden, Norway, Denmark and Finland) for the period 2001-2009. We find that increases in the proportion of ICT-intensive human capital boosts productivity. This seems to confirm the case in favour of recruitment of highly skilled ICT employees. However, the gains vary across countries and industries, suggesting that the channels through which the effects operate are narrower for ICT-intensive human capital than for skilled human capital in general. Our findings provide an important message to the EU employment policy debate that currently revolves around the skill mismatch in general and the unmet demand for ICT skills in particular.","","","",""
13,"","MPMKB18","Marcellino, M. G.; Papailias, F.; Mazzi, G. L.; Kapetanios, G.; Buono, D.","Big data econometrics: Now casting and early estimates","",,82,"","",2018,"","Research Paper Series","https://papers.ssrn.com/sol3/papers.cfm?abstract_id=3206554","","","","","","","","","BAFFI-CAREFIN Centre","","BAFFI-CAREFIN Centre","","This paper aims at providing a primer on the use of big data in macroeconomic nowcasting and early estimation. We discuss: (i) a typology of big data characteristics relevant for macroeconomic nowcasting and early estimates, (ii) methods for features extraction from unstructured big data to usable time series, (iii) econometric methods that could be used for nowcasting with big data, (iv) some empirical nowcasting results for key target variables for four EU countries, and (v) ways to evaluate nowcasts and ash estimates. We conclude by providing a set of recommendations to assess the pros and cons of the use of big data in a specic empirical nowcasting context.","","","",""
13,"","PBS14","Pantea, S.; Biagi, F.; Sabadash, A.","Are ICT displacing workers? Evidence from seven European countries","",,JRC9112,"","",2014,"","","https://ec.europa.eu/jrc/sites/jrcsh/files/JRC91122_ICT_displacing_workers.pdf","","","","","","","","","Joint Research Centre of the European Commission","","Joint Research Centre of the European Commission","","This paper examines whether ICT substitute labour and reduce the demand for labour. We used firm-level comparable data separately for firms in manufacturing, services and ICT-producing sectors from seven European countries. We adopted a common methodology and applied it to a unique dataset provided by the ESSLait Project on Linking Microdata. We controlled for unobservable time-invariant firm-specific effects and we found no evidence of a negative relationship between intensity of ICT use and employment growth. We read this as an indication that ICT use is not reducing employment among ICT using firms.","","","",""
13,"","Sabadash14","Sabadash, A.","Employment of ICT specialists in the EU (2000-2012)","",,JRC92503,"","",2014,"","Working Papers on Digital Economy 2014-01, MPRA Paper 61644","https://ec.europa.eu/jrc/sites/jrcsh/files/JRC92503_Employment_of_ICT_Specialists.pdf","","","","","","","","","Joint Research Centre of the European Commission","","Joint Research Centre of the European Commission","","This study examines the evolution of the number of ICT-skilled workers employed in industry sectors in the EU28  over  the  period  2000-2012. Data are taken from the Eurostat Labour Force Statistics. It introduces a novel definition of ICT specialists that combines occupations and skills taxonomies. For the period prior to the introduction of the Standard Classification of Occupations (ISCO-08) it starts from the OECD definition but includes a wider range of ICT  occupations. From  2011 onwards it adopts the thematic view for ICT occupations proposed by the ILO (2012). It confirms that employment of  ICT specialists  in  the EU27 has  been  resilient  to  the  economic downturn and  uncertainty in global  labour markets, and was able to maintain a growth path of 4.3\% per year over the period  2000-2012,  more than 7 times higher than average growth of total employment over the same period. Though ICT employment evolved cyclically it never turned negative. This rapid growth in ICT employment confirms the increasing importance of ICT technologies in the global economy.","see also https://mpra.ub.uni-muenchen.de/61644/1/MPRA_paper_61644.pdf","","",""
8,"","BBBEKLMR15","Boxall, M.; Brown, G.; Buono, D.; Elliott, D.; Kirchner, R.; Ladiray, D.; Mazzi, G. L.; Ruggeri Cannata, R.","ESS guidelines on seasonal adjustment","",,,"","",2015,"","","https://ec.europa.eu/eurostat/documents/3859598/6830795/KS-GQ-15-001-EN-N.pdf","","","","","","","","","","","","","The establishment of common guidelines for seasonal adjustment (SA) within the European Statistical System (ESS) is an essential step towards a better harmonisation and comparability of infra-annual statistics, especially Principal European Economic Indicators (PEEIs). The ESS Guidelines on Seasonal Adjustment address the need for harmonisation expressed on several occasions by many users such as the European Central Bank (ECB), European Commission services, and the ECOFIN Council. The definition of best practices in the field of seasonal adjustment has been long debated at European level. Since 2007, the Seasonal Adjustment Steering Group co-chaired by Eurostat and the ECB gave a new and crucial input to the compilation of the first edition of the guidelines, published in 2009. The first edition has been widely accepted and implemented. However, taking into account the experience accumulated since 2009 and the need to further clarify some specific aspects, in 2012 the Seasonal Adjustment Steering Group decided to launch a revision of the guidelines. The ESS Guidelines on Seasonal Adjustment are the outcome of the revision work and the ESS Committee (ESSC) endorsed them in November 2014. The revised ESS Guidelines on Seasonal Adjustment present both theoretical aspects and practical implementation issues in a friendly and easy to read framework, thereby addressing both experts and non- experts in seasonal adjustment. They meet the requirement of principle 7 (Sound Methodology) of the European Statistics Code of Practice and their implementation will also be in line with principles 14 (Coherence and Comparability) and 15 (Accessibility and Clarity). The guidelines also foster the transparency of seasonal adjustment practices by encouraging the documentation of all seasonal adjustment steps and the dissemination of seasonal adjustment practices by means of the metadata template for seasonal adjustment. Finally they allow for development of expertise and capacity building. The revised version of the guidelines includes a new section with a policy for seasonal adjustment, making the revised version of the guidelines consistent with the guidelines on revisions policies. It also better describes the different steps in seasonal adjustment. Finally the specification of alternatives has been reviewed, making them more operational.","","","",""
8,"","BEMBFGGHIMOPSTD18","Buono, D.; Elliott, D.; Mazzi, G. L.; Bikker, R.; Fr{\"o}lich, M.; Gatto, R.; Guardalbascio, B.; Hauf, S.; Infante, E.; Moauro, F.; Oltmanns, E.; Palate, J.; Safr, K.; Tibert Stoltze, P.; Di Iorio, F.","ESS guidelines on temporal disaggregation, benchmarking and reconciliation","",,,"","",2018,"","","https://ec.europa.eu/eurostat/documents/3859598/9441376/KS-06-18-355-EN.pdf","","","","","","","","","","","","","In official statistics there is an increasing demand for indicators at a higher frequency than those that have traditionally been observed. Direct measures of indicators at a high frequency can be very costly and difficult to achieve sometimes resulting in low quality results when the information set is not adequate. In such situations temporal disaggregation techniques can constitute a feasible alternative to the direct estimation of high frequency indicators. Additionally, even when high frequency indicators can be directly compiled, they are often not consistent over time with lower frequency versions. For example, annual surveys with larger samples may give more accurate estimates of the level of a variable compared to estimates from a small monthly survey that is designed to provide estimates of monthly change. Under the hypothesis that low frequency indicators are more reliable than high frequency ones, benchmarking techniques can be used to ensure the time consistency between high and low frequency indicators. Finally, directly or indirectly measured high frequency indicators may not necessarily meet required accounting and aggregation constraints. If that low frequency indicators meet accounting and aggregation constraints, reconciliation techniques can be used to restore them on high frequency indicators too. Eurostat and the European Statistical System (ESS) developed these guidelines to help data producers derive high frequency data (e.g. quarterly or monthly) from low frequency data (e.g. annual) and to address related temporal and accounting constraints. Typical applications are known as temporal disaggregation, benchmarking, and reconciliation. The guidelines identify best practice to: (i) achieve harmonization across national processes; (ii) enhance comparability between results; (iii) ensure consistency across domains and between aggregates and their components. The establishment of common guidelines for temporal disaggregation within the European Statistical System (ESS) is an essential step towards better harmonization and comparability of official statistics, especially in macroeconomic indicators and labour market statistics. These guidelines address the need for harmonization expressed by users from European and National Institutions. This document presents both theoretical aspects and practical implementation issues in a user friendly and easy to read framework. They meet the requirement of principle 7 (Sound Methodology) of the European Statistics Code of Practice (CoP), and their implementation is consistent with principles 14 (Coherence and Comparability) and 15 (Accessibility and Clarity). The guidelines also provide transparency of temporal disaggregation, benchmarking and reconciliation practices by encouraging documentation and dissemination of practices. These guidelines are complementary to the ESS guidelines on seasonal adjustment (Eurostat, 2015 edition), the ESS guidelines on revision policy for PEEIs (Eurostat, 2013 edition), and the Eurostat and United Nations handbook on rapid estimates. They are also in line with the Handbook on quarterly national accounts (Eurostat, 2013 edition).","","","",""
8,"","VTL18","Capaccioli, M.; Gramaglia, L.; Pellegrino, M.","Validation and Transformation Language user and reference Manual","",,,"","",2018,"","","https://sdmx.org/wp-content/uploads/VTL-2.0-package-2018.07.12.zip","","","","","","","","","","Statistical Data and Metadata eXchange (SDMX)","","","","","","",""
6,"","BKB18","Bach, F.; Kloek, W.; Bujnowska, A.","Statistical confidentiality: New initiatives in the European Statistical System","",,,"","",2018,"","\href{https://www.q2018.pl/wp-content/uploads/Sessions/Session%2031/Fabian%20Bach/Session%2031_Fabian%20Bach.pptx}{Online presentation}","https://www.q2018.pl/wp-content/uploads/Sessions/Session%2031/Fabian%20Bach/Session%2031_%20Fabian%20Bach.docx","Proc. Quality conference","","","","","","","","","","","","The protection of confidential information has a huge impact on how statistical data can be published and used for analysis, which makes it a key aspect of data quality. This paper presents new methods and tools currently being investigated in the ESS in order to publish more - and more useful - data without compromising statistical confidentiality. It covers new methodological and IT developments, where concrete use cases demonstrate their impact on data quality. For instance, a promising methodological direction is random noise: several ESS use cases at different maturity stages are presented, including recommendations for the harmonised protection of 2021 EU Census data. Another direction is to reflect at a more fundamental level where protection is needed. Several ideas will be presented along this line.","","","",""
6,"","Bujnowska17","Bujnowska, A.","Statistical confidentiality in European business statistics","",,,"","",2017,"","","https://www.unece.org/fileadmin/DAM/stats/documents/ece/ces/ge.46/2017/1_confidentiality_europe.pdf","Proc. work session on Statistical Data Confidentiality","","","","","","","","","United Nations Economic Commission for Europe","","","","","","",""
6,"","Capaccioli17","Capaccioli, M.","The Eurostat Process Management Framework","",,,"","",2017,"","","http://www.unece.org/fileadmin/DAM/stats/documents/ece/ces/ge.58/2017/mtg4/Paper_5_-_PMF_Eurostat.pdf","Proc. workshop on Implementing Efficiencies and Quality of Output","","","","","","","","","United Nations Economic Commission for Europe","","","The statistical organisations are facing several challenges: their mission is evolving, the budget and human resources are shrinking and new IT technologies are appearing on the market. They need to improve their rapidity to respond to new user requirements and maintain at the same time  high quality products and services. In this context, managing business processes is an important sign of maturity and efficiency in organisations. Eurostat has decided to launch the project Process Management Framework (PMF) with the objective to build a harmonised documentation of  the Eurostat processes, increase the process management maturity and create a pool of competence for business process modelling. This project is strongly linked with the Quality review initiative undertaken by Eurostat.","","","",""
6,"","Florescu18","Florescu, D. C.","European structural farm statistics \textendash New quality rating system","",,,"","",2018,"","\href{https://www.q2018.pl/wp-content/uploads/Sessions/Session%2019/Denisa%20Florescu/Session%2019_Denisa%20Florescu.pptx}{Online presentation}","https://www.q2018.pl/wp-content/uploads/Sessions/Session%2019/Denisa%20Florescu/Session%2019_Denisa%20Florescu.DOCX","Proc. Quality conference","","","","","","","","","","","","Eurostat, together with the statistical bodies belonging to the European Statistical System (ESS), has adopted a quality rating system to guide the dissemination of structural farm statistics derived from farm structure surveys. The system does this by showing when the estimates are sufficiently reliable to be published, either with or without a warning. It is based on: (i) coefficients of variations for totals and means of continuous variables; (ii) standard errors for proportions and counts. This paper also presents the work carried out to harmonise variance estimation methods and their application within the ESS. To apply the new quality rating system consistently, Eurostat and the national statistical bodies must compute roughly the same variance estimates. Future structural farm statistics will come from the data collected from 'Integrated Farm Statistics', based on a modular approach. This will lead to more complex national sampling designs. The paper also outlines ongoing developments towards integrating additional sampling design information specific to national multi-stage sampling in the estimation of variance. The paper also introduces new quality reporting based on the European Standard Quality Reporting System (ESQRS) template. This is of great help in assessing all quality dimensions, thereby improving the quality of EU data and metadata. Farm structure surveys are the main source of information on the current state of agriculture and the trends it is undergoing, required to monitor the common agricultural policy and other EU policies. High-quality data are essential for decision-makers.","","","",""
6,"","GGM19","Grazzini, J.; Gaffuri, J.; Museux, J.-M.","Delivering Official Statistics as Do-It-Yourself services to foster produsers' engagement with Eurostat open data","",,,"","",2019,"","","https://www.researchgate.net/publication/332079417_Delivering_Official_Statistics_as_Do-It-Yourself_services_to_foster_produsers'_engagement_with_Eurostat_open_data","Proc. New Techniques and Technologies for Statistics (NTTS)","","","","","","","","","","","","Opening up data obviously provides the opportunity to involve actors from outside the European Statistical System - say produsers, e.g., statisticians, scientists, citizens - and promote innovative, user-centric ways to tackle new and existing policy issues by co-designing statistical products. This also has the potential to increase National Statistical Offices efficiency and effectiveness. However, open data alone does not automatically translate to public participation to the decision-making. In most data provision services, there is an overarching top-down ideology since statistical processes are still owned, dictated and designed by National Statistical Offices and the final users are only involved as the receivers of the data and/or services . We propose to move away from the current approach by providing tools and software for accessing and using online data, so as to enable sharing best practices, learning from others' experience, adopt common methodologies, enhance cooperation between data producers and data users, and further engage in Open Data-driven innovation.","","","",""
