BibliographyType,ISBN,Identifier,Author,Title,Journal,Volume,Number,Month,Pages,Year,Address,Note,URL,Booktitle,Chapter,Edition,Series,Editor,Publisher,ReportType,Howpublished,Institution,Organizations,School,Annote,Custom1,Custom2,Custom3,Custom4,Custom5
6,"","GL17","Grazzini, J.; Lamarche, P.","Production of social statistics... goes social!","",,,"","",2017,"","","https://www.researchgate.net/publication/324208747_Production_of_social_statistics_goes_social","Proc. New Techniques and Technologies for Statistics (NTTS)","","","","","","","","","","","","The scope of this paper is to present a practical framework adopted for the integration of software applications into a statistical production chain. The focus is the actual implementation of a high-level collaborative platform aiming not only at producing social statistics, but also at further fostering experimentation and analysis in that field. In doing so, we strongly support the (obvious) claim that "the modernisation and industrialisation of official statistical production needs a unified combination of statistics and computer science in its very principles". Motivated by the consensus that processes - in particular statistical processes - for data-driven policy should be transparent, we naturally promote open, reproducible, reusable, verifiable, and collaborative software development and deployment in a statistical organisation. Beyond just devising guidelines and best practices, we show how the platform is implemented for the production of social statistics. For that purpose, we adopt a reasonable mix of bottom-up (from low-level scope to high-level vision) and top-down (from black-box process models to traceable functional modules) designs, so as to "think global, [and] act local". In building the parts while planning the whole, we provide with a flexible and agile approach to immediate needs and current legacy issues, as well as long-term problems and potential future requirements for statistical production.","","","",""
6,"","GLGM18","Grazzini, J.; Lamarche, P.; Gaffuri, J.; Museux, J.-M.",""Show me your code, and then I will trust your figures": Towards software-agnostic open algorithms in statistical production","",,,"","",2018,"","","https://www.researchgate.net/publication/325320551_Show_me_your_code_and_then_I_will_trust_your_figures_Towards_software-agnostic_open_algorithms_in_statistical_production","Proc. Quality conference","","","","","","","","","","","","This contribution aims at further promoting the development and deployment of open, reproducible, reusable, verifiable, and collaborative computational resources in statistical offices regardless of the platform/software in use. Motivated by the consensus that data-driven evidence-based policymaking should be transparent, we argue that such approach is not only necessary for the practical implementation of statistical production systems, but also essential to reinforce the quality and trust of official statistics, especially in the context of a 'post-truth' society. We discuss some practical requirements to gear the continuous and flexible development and deployment of software components in production environments. Together with the adoption of some best practices derived from the open source community and the integration of new technological solutions, we propose to unleash the social power of open algorithms so as to create new participatory models of interaction between produsers that can contribute to a more holistic and extensive approach to production systems. Overall, a greater transparency in designing production processes is expected to result in a better grip on the quality of the statistical processes involved in data-driven policy-making. We illustrate this flexible and agile approach with various open, stand-alone software or source code used in statistical production environments at Eurostat.","","","",""
6,"","GMH18","Grazzini, J.; Museux, J.-M.; Hahn, M.","Empowering and interacting with statistical produsers: A practical example with Eurostat data as a service","",,,"","",2018,"","","https://www.researchgate.net/publication/325973362_Empowering_and_interacting_with_statistical_produsers_a_practical_example_with_Eurostat_data_as_a_service","Proc. Conference of European Statistics Stakeholders (CESS)","","","","","","","","","","","","While the importance of openness and transparency in statistical processes, and how these can be supported through open algorithms and open data, has been already emphasized, this contribution aims at showcasing an approach where algorithms and data are delivered as interactive, reusable and reproducible computing services. This will eventually provide produsers with the necessary tools to perform, for themselves, data analytics on Eurostat data in a straightforward manner.","","","",""
6,"","IB13","Infante, E.; Buono, D.","New technique for predictability, uncertainty, implied volatility and statistical analysis of market risk using SARIMA forecasts intervals","",,,"","",2013,"","","https://ec.europa.eu/eurostat/cros/system/files/NTTS2013fullPaper_143.pdf","Proc. New Techniques and Technologies for Statistics (NTTS)","","","","","","","","","","","","Market price data plays an essential role when aiming at the production of quality statistics to be used by policy makers at EU level. Market risk can be defined as the risk of losses in positions arising from movements in market prices, generally linked to the risk that commodity prices and/or their implied volatility will change. From the analyst's perspective, the most informative data are possibly located within the end-series observations. This paper proposes a new Technique for Statistics to be used for assessing the presence of commodity risk that might cause market risk. The underlining idea is to assess whether the realized prices for a determined product in a specified time span is significantly apart from the SARIMA forecasts intervals. Such procedure aims also at identifying the type of eventual outliers present within the end-series observations. An applied case study on agricultural price statistics in Italy is here presented.","","","",""
6,"","IBB13","Infante, E.; Buono, D.; Buono, A.","IB test for direct versus indirect approach in seasonal adjustment","",,,"","",2013,"","","https://ec.europa.eu/eurostat/cros/system/files/NTTS2013fullPaper_143.pdf","Proc. New Techniques and Technologies for Statistics (NTTS)","","","","","","","","","","","","The seasonally adjusted series of an aggregate can be obtained by seasonal adjusting it ("direct approach") or by aggregating the seasonally adjusted individual series ("indirect approach"). The literature to date has mainly focused upon an a posteriori comparison among the results achieved by applying different approaches. Here a new a priori test (IB test) for choosing between direct and indirect approach in seasonal adjustment is proposed. The test is applied before running any seasonal adjustment procedure. When the individual series present common seasonal patterns the aggregate will be adjusted directly, otherwise an indirect approach could be preferred. Sections 3 and 4 include a simulation and a case study, respectively. This paper seeks to set out an a priori strategy for the identification of the most effective seasonal adjustment approach to be used.","","","",""
6,"","Lamboray19","Lamboray, C.","Elementary aggregation: A not so elementary story!","",,,"","",2019,"","","https://eventos.fgv.br/sites/eventos.fgv.br/files/arquivos/u161/elementary_aggregation_og_lamboray.pdf","Meeting of the Ottawa Group","","","","","","","","","","","","The compilation of a CPI is often presented in two stages. First, prices are aggregated without weights at the elementary level. Prices are typically obtained from dedicated surveys for which price collectors visit outlets  and  record  the  observed  prices.  These  elementary  price  indices  are  then  aggregated  to  the  higher  levels using expenditure weights.  Nowadays,  CPIs  are  becoming  a  multi-source  statistics  where  prices  are  obtained  not  only  from  price  collection  in  the  field  but  also  from  transaction  data,  administrative  data  or  from  the  Internet  using  web  scraping techniques. Depending on the data source, different strategies can be adopted for constructing the elementary aggregates and for compiling elementary price indices. A CPI may be compiled in more than two stages and weights may be available even within the elementary aggregates. With scanner data, the index compiler must make two main structural decisions which can have a significant impact on inflation measurement. First, the item which is being aggregated must be defined. Second, the level must be fixed up to which these items are first aggregated. To discuss this second issue, we distinguish two strategies for a category that can be divided into sub-categories. Either the items are directly aggregated to the category level, possibly using a multilateral method. Alternatively, the multilateral method aggregates only up to the sub-category level, and these intermediate sub-category level indices are then aggregated to the  category  level  using  for  instance  a  Laspeyres-type  index  formula.  The  objective  of  this  paper  is  to  examine the impact of introducing this additional level of fixity in the CPI structure.","","","",""
6,"","LGRMGMH19","Luhmann, S.; Grazzini, J.; Ricciato, F.; Meszaros, M.; Giannakouris, K.; Museux, J.-M.; Hahn, M.","Promoting reproducibility-by-design in statistical offices","",,,"","",2019,"","","https://www.researchgate.net/publication/332045930_Promoting_reproducibility-by-design_in_statistical_offices","Proc. New Techniques and Technologies for Statistics (NTTS)","","","","","","","","","","","","This paper emphasizes the need for Official Statistics to go beyond current practice and exceed the limits of the National Statistical Offices and the European Statistical System to reach and engage with produsers - e.g. statisticians, scientists and citizens. Through the adoption of some best practices derived from the Open Source Software community and the integration of modern technological solutions, the "Shared, Transparent, Auditable, Trusted, Participative, Reproducible, and Open" principles can help create new participatory models of knowledge and information production.","","","",""
6,"","LSJ16","Lazar, A. C.; Selenius, J.; Jortay, M.","Strategy for agricultural statistics 2020 and beyond: for the future European Agricultural Statistics System (EASS).","",,,"","",2016,"","","https://www.istat.it/storage/icas2016/f37-lazar.pdf","Proc. International Conference on Agricultural Statistics","","","","","","","","","","","","Many important policies of the European Union, such as the Common Agricultural Policy, depend on agricultural statistics. These statistics need to be of high quality, coherent, comparable and flexible, and should be produced efficiently based on users' needs in order to best serve evidence-based policy making and monitoring. The current EU agricultural statistics system does not fulfil these requirements well enough. To address this, Eurostat launched the "New legislation on Agricultural Statistics for a strategy towards 2020 and beyond" initiative in 2014. It aims to introduce two new legal frameworks stepwise: an"Integrated Farm Statistics" Regulation which will provide the basis for collecting farm level micro-data, based on a modular approach with core, module and ad hoc surveys; and a "Statistics on Agricultural Input/Output" Regulation which will provide aggregated statistics in tabular form. These frameworks will contain basic elements such as scope, precision and quality requirements and will use common definitions and classifications, while more technical elements will be covered by secondary legislation. EU Member States will be free to choose data sources, including administrative and other new data sources. This paper presents the Strategy for agricultural statistics 2020 and beyond and shows its suitability to meet technical and methodological requirements as well as to successfully navigate the complex institutional, legal and political context within the European Union and its 28 Member States. It can therefore serve as an instructive example for a cross-border implementation of the United Nations Global Strategy to improve agricultural and rural Statistics.","","","",""
6,"","Meszaros19","M\'esz\'aros, M.","Aggregating flags \textendash A standardised and rational approach","",,,"","",2019,"","\href{https://coms.events/ntts2019/data/full_papers/full_paper_90.pdf}{Online poster}","https://coms.events/ntts2019/data/x_abstracts/x_abstract_90.docx","Proc. New Techniques and Technologies for Statistics (NTTS)","","","","","","","","","","","","A flag is an attribute of a cell in a data set that provides additional qualitative information about the statistical value of that cell. They can indicate a wide range of information, for example, that a given value is estimated, confidential or represents a break in the time series. Currently different sets of flags are in use in the European Statistical System (ESS). Some statistical domains use the SDMX code list for observation status and confidentiality status, OECD uses a simplified version of the SDMX code lists and Eurostat uses a short list of flags for dissemination which combines the observation and confidentiality status. While in most cases it is well defined how a flag shall be assigned to an individual value, it is not straightforward to decide what flag shall be propagated to aggregated values like a sum, an average, quantiles, etc. This topic is important for Eurostat as the European aggregates are derived from national data points. Thus the information contained in the individual flags need to be summarized in a flag for the aggregate. This issue is not unique to Eurostat, but can occur for any aggregated data. For example, a national statistical institute may derive the national aggregate from regional data sets. In addition, the dissemination process provides further peculiarity: only a limited set of flags, compared to the set of flags used in the production process, can be applied in order to make it easily understandable to the users. In the scientific community there is a wide range of research about the consequences of data aggregation but it concentrates only on the information loss during aggregation of information and there is no scientific guidance how to aggregate flags. This paper is an attempt to provide a picture about the current situation and provide some systematic guidance how to aggregate flags in a coherent way. Eurostat is testing various approaches with a view to well balance transparency and clarity of the information made available to users in a flag. From several options, 3 methods (hierarchical, frequency and weighted frequency) are implemented in an R package for assigning a flag to an aggregate based on the underlying flags and values. Since the topic has relevance outside of Eurostat as well, it was decided to publish the respective code with documentation with a view to foster re-use within the European Statistical System and to stimulate discussion, including with the user community.","","","",""
6,"","MPJ08","Museux, J.-M.; Peeters, M.; Jo\ {a}o Santos, M.","Legal, political and methodological issues in confidentiality in the European Statistical System","",5262,,"","324-334",2008,"#A_H#","","https://link.springer.com/chapter/10.1007/978-3-540-87471-3_27","Proc. International Conference on Privacy in Statistical Databases","","","Lecture Notes in Computer Science","Domingo-Ferrer, J.; Saygın, Y.","Springer","","","","","","","The paper discusses the challenges linked to the need of the research community to have access to microdata files for scientific purposes. These needs have to be adequately balanced with the legal requirement of preserving the confidentiality of respondents. The paper presents the policies and instruments available at the European Union to progress in the supply of data to the research community, while respecting the legal requirements. More specifically, the paper explains the current process dealing with research projects and the work of the European Statistical System Network (ESSnet) project for statistical disclosure control. Finally the paper describes future trends that are currently investigated in the European Union, and more specifically the development of remote access facilities, the enhancement of disclosure control tools and the convergence towards common policies in Member States.","","","",""
6,"","MRR18","Martins Ferreira, P.; R\'emond-Tiedrez, I.; Rueda-Cantuche, J. M.","QDR methodology: Understanding bilateral trade flows in the European Union","",,,"","",2018,"","\href{https://www.iioa.org/conferences/26th/papers/files/3338.pdf}{Online abstract}","https://www.iioa.org/conferences/26th/papers/files/3348_20180515021_iioa2018_QDR.pdf","Proc. International Input-Output Conference","","","","","","","","","","","","Trade asymmetry has been a well-known fact and there are extensive literature and reports about the causes for those asymmetries. There is also a  recognised effort made by trade statisticians for mitigate trade asymmetry over time. Notwithstanding the positive achievements that have been made so far, to build an Inter-Country Supply, Use and Input-Output tables (IC-SUIOT) we more than low trade asymmetry: we need no trade asymmetry at all. The European Statistical System (ESS) has an extensive and rich amount of trade data and a lot of resources are devoted to measure trade flows. Nevertheless, the customs union of the EU adds another challenge regarding trade in goods statistics: Member-States declare imports/exports for customs or tax purposes without thisMember State having acquired ownership of the goods,  i.e. declare quasi-transit as well. While relevant  for physical  flow of  trade, quasi-transit and re-exports distort the geographical economic relationship among Member-States and therefore they should be identified and taken into account in the framework of IC-SUIOT. QDR methodology was developed in order to address the specificities of trade in goods in EU by providing a way to estimate  consolidated trade flows, i.e. solving trade asymmetries, between two countries by three types of trade: quasi-transit (Q), domestic (D) and re-export (R). For quasi-transit and re-exports the intermediary country between that takes part of the physical  flow between origin and destination is also identified. QDR methodology was used in FIGARO project and it revealed very useful for identifying  relevant trade relationships within countries.","","","",""
6,"","RAR16","R\'emond-Tiedrez, I.; Amores, A. F.; Rueda-Cantuche, J. M.","Development of a quality adjusted labour productivity index in the European Union \textendash Example of the employment embodied in European exports","",,,"","",2016,"","","https://www.iioa.org/conferences/24th/papers/files/2341.pdf","Proc. International Input-Output Conference","","","","","","","","","","","","The  paper will introduce the methodology for the Quality Adjusted Labour Index (QALI) in the European Union which combines macro-data from  National Accounts (which are the benchmarked data)  and micro-data from the EU statistics of the Labour Force survey (LFS) and the Structural Earnings Survey (SES). The Quality Adjusted Labour Input is constructed for the EU-28, EA-19 and each EU MS, whenever data are available, for the  full time series from 2002 to 2013, with possible extension to 2014. Survey-based data of hours worked and earnings for 2002-2007 are converted from NACE Rev.1.1to  NACE  Rev.2. The QALI values by EU Member State are weighted by skills,  by age and by combinations of skill and age groups. The industry breakdown varies depending on countries due to reliability/confidentiality constraints of the survey data: 21 industries (A21) for some countries, EU28 and EA19; 10 industries (A10); and the total economy. Connected to the decomposition of the volume by type of workers (by age and by skill), the results will give interesting insights on what kind of employment is supported by European exports in terms of age, qualifications,  and in which industrial activities. The results will be based on the European consolidated Supply, Use and Input-Output Tables produced annually by Eurostat.","","","",""
6,"","RB19","Ricciato, F.; Bujnowska, A.","Privacy and data confidentiality for Official Statistics: New challenges and new tools","",,,"March","",2019,"","","https://coms.events/ntts2019/data/x_abstracts/x_abstract_190.pdf","Proc. New Techniques and Technologies for Statistics (NTTS)","","","","","","","","","","","","The modern society is undergoing a process of massive datafication. The availability of new digital data sources represents an opportunity for Statistical Offices (SO) to complement traditional statistics as well as to produce novel statistical products with improved timeliness and relevance. However, such opportunities come with important challenges in almost every aspect – methodological, business models, data governance,regulation, organizational and others. The new scenario calls for an evolution of the modus operandi adopted by SO also with respect to privacy and data confidentiality, that is the focus of the present contribution. We propose here a discussion framework focused on the prospective combination of advanced Statistical Disclosure Control (SDC) methods with Secure Multi-Party Computation (SMC) techniques.","","","",""
6,"","RBWHB19","Ricciato, F.; Bujnowska, A.; Wirthmann, A.; Hahn, M.; Barredo-Capelot, E.","A reflection on privacy and data confidentiality in Official Statistics","",,,"","",2019,"","","https://www.bis.org/ifc/events/isi_wsc_62/ips177_paper3.pdf","Proc. International Statistical Institute (ISI) World Statistics Congress","","","","","","","","","","","","The  availability of new digital data sources represents an opportunity for Statistical  Offices (SO) to complement traditional statistics and/or deliver novel statistics with improved timeliness and relevance. Nowadays SOs are  part of a larger "data ecosystem" where different organizations, including public institutions and private companies, engage in  the collection and processing of different kinds of (new) data about citizens, companies, goods etc.  In this multi-actors scenario it is often desirable to let one organization extract some output statistics (i.e., aggregate information) from input data that are held by other organization(s) in different administrative domain(s). We refer to this problem as cross-domain statistical processing. To achieve this goal, the most intuitive approach - but not the only one - is  to exchange raw input data across administrative domains (organizations). However, this  strategy is not always viable when personal input data are involved, due to a combination of regulatory constraints (including lack of explicit legal basis for data sharing), business confidentiality, privacy  requirements, or a combination of the above. Furthermore, new data sources often embed a much more pervasive view about individuals than traditional survey and/or administrative data, an aspect that amplifies the potential risks of data concentration. In such cases, performing cross-domain  statistical processing requires technologies to elicit only the agreed-upon output information (exactly or approximately) without revealing the input data. This entails addressing two  distinct but complementary problems. First, we need to compute the desired output statistics without seeing the raw input data. Second, we need to control the amount of information that might be inferred about individual data subjects in the input dataset from the output. In the field of privacy engineering the notions of "input privacy" and "output privacy" are used to refer respectively to these two problems. We remark that these problems are separable, i.e., they can be addressed with distinct tools and methods that get combined together, overlaid or juxtaposed. In this contribution we review recent advances in  both fields and briefly discuss their complementary roles. As for input privacy, we provide a brief introduction to the fundamental principles of Secure Multi-Party Computation (SMPC). As for output privacy, we review recent advances in the field of Statistical Disclosure Control (SDC). Finally, we discuss possible scenarios for SMPC and SDC integration in the future "confidentiality engineering" setup of modern official statistics.","","","",""
